{
  "meta": {
    "title": "Procurement KPI Analysis",
    "generatedBy": "tools/procurement/build_case_data.py",
    "source": {
      "name": "Procurement KPI Analysis Dataset.csv",
      "publisher": "Shahriar Kabir on Kaggle",
      "datasetId": "shahriarkabir/procurement-kpi-analysis-dataset",
      "retrieved": "2026-07-28",
      "licenseClaim": "CC0: Public Domain, as listed by the dataset publisher",
      "sha256": "bf9a529c52cd7de254994a55d087f865d3aefc0ba66790e8ee43a26e7beb6e9c",
      "rows": 777,
      "coverage": "2022\u20132023"
    },
    "assumptions": {
      "onTimeDeliveryDays": 10,
      "weekPeriod": "W-SAT ends Saturday and starts Sunday",
      "defectRate": "Rows missing Defective_Units are excluded from the defect denominator",
      "deliveryRate": "Rows missing Delivery_Date are excluded from on-time delivery"
    },
    "presetWeights": {
      "balanced": {
        "cost": 0.25,
        "reliability": 0.25,
        "quality": 0.25,
        "compliance": 0.25
      },
      "cost": {
        "cost": 0.55,
        "reliability": 0.15,
        "quality": 0.15,
        "compliance": 0.15
      },
      "reliability": {
        "cost": 0.15,
        "reliability": 0.55,
        "quality": 0.15,
        "compliance": 0.15
      },
      "quality": {
        "cost": 0.15,
        "reliability": 0.15,
        "quality": 0.4,
        "compliance": 0.3
      }
    },
    "sourceProfile": [
      {
        "column": "PO_ID",
        "dtype": "object",
        "missing": 0,
        "unique": 777,
        "examples": [
          "PO-00001",
          "PO-00002",
          "PO-00003"
        ],
        "numeric": null
      },
      {
        "column": "Supplier",
        "dtype": "object",
        "missing": 0,
        "unique": 5,
        "examples": [
          "Alpha_Inc",
          "Delta_Logistics",
          "Gamma_Co"
        ],
        "numeric": null
      },
      {
        "column": "Order_Date",
        "dtype": "datetime64[ns]",
        "missing": 0,
        "unique": 476,
        "examples": [
          "2023-10-17 00:00:00",
          "2022-04-25 00:00:00",
          "2022-01-26 00:00:00"
        ],
        "numeric": null
      },
      {
        "column": "Delivery_Date",
        "dtype": "datetime64[ns]",
        "missing": 87,
        "unique": 449,
        "examples": [
          "2023-10-25 00:00:00",
          "2022-05-05 00:00:00",
          "2022-02-15 00:00:00"
        ],
        "numeric": null
      },
      {
        "column": "Item_Category",
        "dtype": "object",
        "missing": 0,
        "unique": 5,
        "examples": [
          "Office Supplies",
          "MRO",
          "Packaging"
        ],
        "numeric": null
      },
      {
        "column": "Order_Status",
        "dtype": "object",
        "missing": 0,
        "unique": 4,
        "examples": [
          "Cancelled",
          "Delivered",
          "Partially Delivered"
        ],
        "numeric": null
      },
      {
        "column": "Quantity",
        "dtype": "int64",
        "missing": 0,
        "unique": 623,
        "examples": [
          1176,
          1509,
          910
        ],
        "numeric": {
          "min": 51,
          "p25": 615.0,
          "median": 1075.0,
          "p75": 1548.0,
          "max": 5000,
          "mean": 1094.6602316602316
        }
      },
      {
        "column": "Unit_Price",
        "dtype": "float64",
        "missing": 0,
        "unique": 747,
        "examples": [
          20.13,
          39.32,
          95.51
        ],
        "numeric": {
          "min": 10.84,
          "p25": 33.29,
          "median": 58.95,
          "p75": 83.13,
          "max": 109.17,
          "mean": 58.28382239382239
        }
      },
      {
        "column": "Negotiated_Price",
        "dtype": "float64",
        "missing": 0,
        "unique": 752,
        "examples": [
          17.81,
          37.34,
          92.26
        ],
        "numeric": {
          "min": 9.27,
          "p25": 30.46,
          "median": 53.8,
          "p75": 76.55,
          "max": 107.39,
          "mean": 53.660720720720725
        }
      },
      {
        "column": "Defective_Units",
        "dtype": "float64",
        "missing": 136,
        "unique": 202,
        "examples": [
          235.0,
          41.0,
          112.0
        ],
        "numeric": {
          "min": 0.0,
          "p25": 26.0,
          "median": 49.0,
          "p75": 100.0,
          "max": 321.0,
          "mean": 74.8034321372855
        }
      },
      {
        "column": "Compliance",
        "dtype": "object",
        "missing": 0,
        "unique": 2,
        "examples": [
          "Yes",
          "No"
        ],
        "numeric": null
      }
    ]
  },
  "quality": {
    "rows": 777,
    "missingDeliveries": 87,
    "missingDefectCounts": 136,
    "cancelledOrders": 63,
    "pendingOrders": 81,
    "impossibleDeliverySequences": 1
  },
  "overview": {
    "name": "All suppliers",
    "orders": 777,
    "spend": 45373696.39,
    "avgUnitPrice": 58.28,
    "avgNegotiatedPrice": 53.66,
    "savingsRate": 0.0797310737970269,
    "avgLeadDays": 10.8,
    "onTimeRate": 0.4629898403483309,
    "defectRate": 0.06802492360336741,
    "complianceRate": 0.8236808236808236,
    "missingDeliveryRate": 0.11196911196911197
  },
  "suppliers": [
    {
      "name": "Alpha_Inc",
      "orders": 141,
      "spend": 7839712.25,
      "avgUnitPrice": 58.39,
      "avgNegotiatedPrice": 53.65,
      "savingsRate": 0.08077736619715202,
      "avgLeadDays": 10.74,
      "onTimeRate": 0.4224137931034483,
      "defectRate": 0.02248297433945402,
      "complianceRate": 0.9361702127659575,
      "missingDeliveryRate": 0.1702127659574468,
      "scores": {
        "balanced": 61.7,
        "cost": 60.6,
        "reliability": 37.0,
        "quality": 75.2
      }
    },
    {
      "name": "Beta_Supplies",
      "orders": 156,
      "spend": 9858665.9,
      "avgUnitPrice": 58.28,
      "avgNegotiatedPrice": 53.61,
      "savingsRate": 0.08279592949925,
      "avgLeadDays": 11.27,
      "onTimeRate": 0.4405594405594406,
      "defectRate": 0.0935461410019807,
      "complianceRate": 0.7564102564102564,
      "missingDeliveryRate": 0.08333333333333333,
      "scores": {
        "balanced": 49.5,
        "cost": 69.7,
        "reliability": 36.4,
        "quality": 46.1
      }
    },
    {
      "name": "Delta_Logistics",
      "orders": 171,
      "spend": 9236240.47,
      "avgUnitPrice": 56.24,
      "avgNegotiatedPrice": 51.9,
      "savingsRate": 0.07805545568859389,
      "avgLeadDays": 10.85,
      "onTimeRate": 0.46357615894039733,
      "defectRate": 0.14429859939869472,
      "complianceRate": 0.6081871345029239,
      "missingDeliveryRate": 0.11695906432748537,
      "scores": {
        "balanced": 10.4,
        "cost": 7.7,
        "reliability": 21.4,
        "quality": 6.2
      }
    },
    {
      "name": "Epsilon_Group",
      "orders": 166,
      "spend": 9851156.06,
      "avgUnitPrice": 59.39,
      "avgNegotiatedPrice": 54.64,
      "savingsRate": 0.07899863661422472,
      "avgLeadDays": 10.87,
      "onTimeRate": 0.4563758389261745,
      "defectRate": 0.029660131133001807,
      "complianceRate": 0.9819277108433735,
      "missingDeliveryRate": 0.10240963855421686,
      "scores": {
        "balanced": 62.1,
        "cost": 46.3,
        "reliability": 49.8,
        "quality": 75.8
      }
    },
    {
      "name": "Gamma_Co",
      "orders": 143,
      "spend": 8587921.71,
      "avgUnitPrice": 59.35,
      "avgNegotiatedPrice": 54.71,
      "savingsRate": 0.07787936192660151,
      "avgLeadDays": 10.19,
      "onTimeRate": 0.5307692307692308,
      "defectRate": 0.04957885462555066,
      "complianceRate": 0.8601398601398601,
      "missingDeliveryRate": 0.09090909090909091,
      "scores": {
        "balanced": 61.3,
        "cost": 36.8,
        "reliability": 76.8,
        "quality": 66.3
      }
    }
  ],
  "categories": [
    {
      "name": "Electronics",
      "orders": 152,
      "spend": 8642550.6,
      "avgUnitPrice": 55.81,
      "avgNegotiatedPrice": 51.47,
      "savingsRate": 0.07915209861584953,
      "avgLeadDays": 11.02,
      "onTimeRate": 0.4316546762589928,
      "defectRate": 0.06410970247273143,
      "complianceRate": 0.8552631578947368,
      "missingDeliveryRate": 0.08552631578947369,
      "suppliers": [
        {
          "name": "Alpha_Inc",
          "orders": 22,
          "spend": 1373105.65,
          "avgUnitPrice": 55.52,
          "avgNegotiatedPrice": 51.03,
          "savingsRate": 0.07022465869171757,
          "avgLeadDays": 10.6,
          "onTimeRate": 0.4,
          "defectRate": 0.024313823787442037,
          "complianceRate": 1.0,
          "missingDeliveryRate": 0.09090909090909091
        },
        {
          "name": "Beta_Supplies",
          "orders": 32,
          "spend": 2156144.46,
          "avgUnitPrice": 61.14,
          "avgNegotiatedPrice": 56.61,
          "savingsRate": 0.08584039470427886,
          "avgLeadDays": 11.13,
          "onTimeRate": 0.43333333333333335,
          "defectRate": 0.0829545815720052,
          "complianceRate": 0.78125,
          "missingDeliveryRate": 0.0625
        },
        {
          "name": "Delta_Logistics",
          "orders": 33,
          "spend": 1808848.01,
          "avgUnitPrice": 50.26,
          "avgNegotiatedPrice": 46.45,
          "savingsRate": 0.08001094863703381,
          "avgLeadDays": 10.68,
          "onTimeRate": 0.42857142857142855,
          "defectRate": 0.12423625254582485,
          "complianceRate": 0.6060606060606061,
          "missingDeliveryRate": 0.15151515151515152
        },
        {
          "name": "Epsilon_Group",
          "orders": 36,
          "spend": 1963897.65,
          "avgUnitPrice": 60.16,
          "avgNegotiatedPrice": 55.01,
          "savingsRate": 0.08255823916895848,
          "avgLeadDays": 11.23,